url,extracted_text
https://www.facebook.com/events/568879236028815/,"Friday 10 January 2025 at 17:00 Amazing Family Event James Bay Victoria About Discussion More About Discussion Amazing Family Event Details 1 person responded Event by Victoria BC Plumbing Ltd James Bay Victoria Public · Anyone on or off Facebook Join us for a throwback Thursday Victoria, British Columbia James Bay Victoria Guests See All"
https://www.facebook.com/events/617389307514857/,"Monday 10 February 2025 from 18:00-21:30 Aetherdrift Prerelease Weekend 103-1633 Hillside Ave, Victoria, BC, Canada, British Columbia V8T 2C4 Sun, 9 Feb Sun, 9 Feb Mon, 10 Feb +3 About Discussion More About Discussion Aetherdrift Prerelease Weekend Details 1 person responded Event by Gauntlet Games 103-1633 Hillside Ave, Victoria, BC, Canada, British Columbia V8T 2C4 Duration: 3 hr 30 min Public · Anyone on or off Facebook Join us for our Aetherdrift Prerelease Weekend at Gauntlet Games! This is your first chance to play with cards from the new Magic set. Players of all skill level are welcome. Basic… See more Victoria, British Columbia 103-1633 Hillside Ave, Victoria, BC, Canada, British Columbia V8T 2C4 1633 Hillside Ave, Victoria, BC V8T 2C4, Canada Guests See All"
https://www.facebook.com/events/640177191684833/,"Sunday 2 February 2025 from 15:30-17:00 Sip & Taste Workshop - Super Bowl Eats vs Valentine Treats Victoria Scout House This event has been cancelled. You cannot share this event, but you can still post. About Discussion More About Discussion Sip & Taste Workshop - Super Bowl Eats vs Valentine Treats Details 18 people responded Event by Gretchen Crane and Mary Lummerding Victoria Scout House Duration: 1 hr 30 min Public · Anyone on or off Facebook Our event unfortunately is cancelled due to recent news of Epicure closer. We will keiiep you posted as the future is unknown of events we may hold! Join Chef Mary & Gretchen, Leader w/Epicure Personal Chef & Epicure Specialist Workshop will include: Help Busy People Break the Cycle of Takeout Tips & Tricks to make Cooking Fun & Easy Health Benefits to Cooking at Home Easy Meal Plans & Recipes Tasting : Super Bowl Eats vs Valentine Treats Enjoy a Delicious Good Food Tasting - GF & Nut Free - Easy Epicure Meals and Baking DF samples will be included $5 For Tasting and Workshop - Gift included! See less Victoria, British Columbia Victoria Scout House 505 Marigold, Victoria On Dec. 11, 1909, Esquimalt resident Lt.-Col. John A. Hall, former commanding officer of the 5th Regiment Canadian Army, initiated a meeting held in the Menzies Street Drill Hall in James Bay to see if there was sufficient interest in the area to form a Boy Scout troop. Seventy-two boys attended. On Jan. 11, 1910 the next step was taken at Hall’s home on Old Esquimalt Road to establish the first council of the Victoria Boy Scouts Association. Hall, instrumental in the organization of the 88th Victoria Fusiliers, was a natural choice to chair the council. In March 1910, the first badges were issued by the council and six troops organized, with the Esquimalt troop assigned 1st Arbutus,’ the name still in use today. In June, the first parade with all scouts in uniform was held at the drill hall after which Edgar Fawcett presented a Union Jack with the letters “V.B.S.” (Victoria Boy Scouts) in the centre. This brigade flag as it was known was presented to the troop with the largest number of scouts on parade. Guests See All"
https://www.facebook.com/events/995590202514541/,"Monday 3 March 2025 from 10:00-16:45 Esquimalt Blood Donation Event CFB Esquimalt About Discussion More About Discussion Esquimalt Blood Donation Event Interested Going Invite Details 1 person responded Event by Canadian Blood Services - British Columbia CFB Esquimalt Duration: 6 hr 45 min Public · Anyone on or off Facebook Donate blood in #Esquimalt Where: CFB Esquimalt - Rainbow Room Book Now: https://shorturl.at/PPQvE Please help fill open appointments in your neighborhood. Invite others to join yo… See more Social issues Victoria, British Columbia CFB Esquimalt Vancouver Island, Esquimalt Guests See All"
https://www.facebook.com/events/3508141146161849/,"Saturday at 19:00 Cafe Runway Caffè Fantastico Specialty Coffees About Discussion More About Discussion Cafe Runway Interested Going Invite Details 4 people responded Event by Olive ThisTea Caffè Fantastico Specialty Coffees Public · Anyone on or off Facebook CAFE RUNWAY - February 22nd TICKETS https://www.universe.com/.../cafe-runway-february-22nd... Welcome back, one and all, to the coziest little show at the coziest little cafe in town! Come in from the snow and warm up with a latte and a lotta laughs as these fabulous performers twirl and whirl around for you. It's Cafe Runway, the all ages drag cabaret! PRESALE : $15 | DOOR : $20 kids under 6 get in free! HOSTED BY OLIVE THISTEA FEATURING TINO BAMBINO SOVEREIGN ACE MISS PINK DIVA RAFFORDI JUSTICE BONNIE V BON ACE OF SPADES ALEXIS ASTRO TOM FOOLERY *Masks are encouraged and celebrated, especially when moving around the space. Please respect everyone's safety and comfort and continue to social distance. Land Acknowledgement: This show is happening on the traditional and stolen lands of the W̱SÁNEĆ and Lekwungen peoples, known today as the Songhees and Esquimalt First Nations. We are committed to working towards decolonization, reconciliation, and reclaimation. *Caffe Fantastico has two levels connected by 2 stairs with a railing. Both the Quadra St and Kings Rd entries are level with the sidewalk. There is a single use wheelchair accessible restroom on both the upper and lower level. *Scent free space! Please respect those with scent sensitivities and refrain from wearing perfume or heavily scented products. *There will be amplified sound via microphone and speakers. Lighting is overhead with no flashing lights. *There is street parking available, as well as bus stops less than one block from the cafe. Please reach out to us to discuss accessibility if needed! This show is a space for LGBTQ+ art. Allies are welcome to join us, please respect the artists and community. There is zero tolerance for racist, homophobic, transphobic, fatphobic, ableist or sexist behaviour. See less Victoria, British Columbia Caffè Fantastico Specialty Coffees 965 Kings Road, Victoria Guests See All"
https://www.facebook.com/events/1896796401266484/,"Thursday 23 January 2025 at 19:00 Whales & Different Species of Cetaceans in BC - BCO Event 865 Yates Street, Victoria, BC, Canada, British Columbia V8W 1M1 About Discussion More About Discussion Whales & Different Species of Cetaceans in BC - BCO Event Details 15 people responded Event by BestCoast Outfitters 865 Yates Street, Victoria, BC, Canada, British Columbia V8W 1M1 Public · Anyone on or off Facebook Join us for the first event of 2025 in collaboration with Cetus Research & Conservation Society. Our speaker, Lindsay Kolb, will guide us as we explore whales and the different species of cetaceans commonly seen in BC We’ll also take a closer look at local whale populations and ecology as well as the various threats they face and what can be done to mitigate them Jan 23rd - 7pm 865 Yates Street, Victoria Send us a DM or email sales@bestcoastoutfitters.com to save your spot. This is a FREE event See less Victoria, British Columbia 865 Yates Street, Victoria, BC, Canada, British Columbia V8W 1M1 865 Yates St, Victoria, BC V8W 1M1, Canada Guests See All"
https://www.facebook.com/events/585580400854221/,"Tuesday 28 January 2025 at 18:00 GLOBUS TD EVENT Victoria Marriott Inner Harbour About Discussion More About Discussion GLOBUS TD EVENT Details 3 people responded Event by Gina Globus Avalon BC Victoria Marriott Inner Harbour Public · Anyone on or off Facebook Email ggoranson@globusfamily.ca for more details https://www.eventbrite.com/cc/tour-director-events-3934753 Victoria, British Columbia Victoria Marriott Inner Harbour 728 Humboldt St, Victoria, BC V8W 3Z5, Canada Guests See All"
https://www.facebook.com/events/1307382783790660/,"Monday 10 February 2025 from 11:00-17:45 Colwood Blood Donation Event Colwood Church About Discussion More About Discussion Colwood Blood Donation Event Details 4 people responded Event by Canadian Blood Services - British Columbia Colwood Church Duration: 6 hr 45 min Public · Anyone on or off Facebook Donate blood in #Colwood Where: Colwood Church Book Now: https://shorturl.at/gDeHB Please help fill open appointments in your neighborhood. Invite others to join you, for groups of 3 or more, email bookagroupbc@blood.ca. For individual appointments or to check your eligibility download the GiveBlood App, call 1-888-2-DONATE or visit blood.ca See less Social issues Langford, British Columbia Colwood Church 2250 Sooke Road, Victoria Colwood Church is a community of people from all walks of life that believe in Jesus, and seek to lov Guests See All"
https://www.facebook.com/events/1404037837455794/,"Friday 31 January 2025 from 18:00-23:00 Members Social Night Edelweiss Club About Discussion More About Discussion Members Social Night Details 6 people responded Event by Cindy Kent and Victoria Edelweiss Club Edelweiss Club Duration: 5 hr Public · Anyone on or off Facebook Enjoy an evening with other members in the Hubertus Lounge.  There is a selection of games to play, darts, German language shows on the TV and a small selection of snacks at the bar including pretzels from our own Bretzel German Traditional Treats. Drop by anytime  between 6 & 11 pm. Not a member yet, you can sign up at the event and also receive discounts to all events throughout the year. See less Victoria, British Columbia Edelweiss Club 108 Niagara Street, Victoria Guests See All"
https://www.facebook.com/events/1250030306275122/,"Saturday 1 March 2025 at 20:00 Victoria Unplugged Music Series ft Amber Banman / Peace Makes Plenty / Kyle Burnett The Moon Under Water Brewery, Pub, Distillery & Tasting Room About Discussion More About Discussion Victoria Unplugged Music Series ft Amber Banman / Peace Makes Plenty / Kyle Burnett Interested Going Invite Details 78 people responded Event by Royalty Entertainment and Royal And Fred The Penguin The Moon Under Water Brewery, Pub, Distillery & Tasting Room Tickets · CA$17.31 www.eventbrite.com/e/1131338777739 Public · Anyone on or off Facebook Join us for the first night in a series of events showcasing some of your favorite Victoria artists stepping away from their regular jams to share you with their acoustic styles in… See more Victoria, British Columbia Tickets Find Tickets The Moon Under Water Brewery, Pub, Distillery & Tasting Room 350B Bay Street, Victoria Locally owned and operated craft brewpub and distillery. Guests See All"
https://www.facebook.com/events/481340948041676/,"Sunday 30 March 2025 from 18:00-23:30 WACKEN METAL BATTLE 2025 : VANCOUVER ISLAND ELIMINATION ROUND. March 30 @ Lucky Bar Lucky Bar, Victoria About Discussion More About Discussion WACKEN METAL BATTLE 2025 : VANCOUVER ISLAND ELIMINATION ROUND. March 30 @ Lucky Bar Interested Going Invite Details 235 people responded Event by The Invisible Orange , Wacken Metal Battle Canada and 5 others Lucky Bar, Victoria Tickets orangetickets.ca/detalles_evento.php Public · Anyone on or off Facebook The annual METAL BATTLE is BACK for 2025!!  WACKEN METAL BATTLE is an international band contest, established in 2004, that aims at discovering new talent and supporting the scene worldwide. With this, the Wacken Open Air supports up & coming artists on a global scale, offering its resources and stages ( https://www.metal-battle.com/ ). The Metal Battle has grown to include 62 countries that hold national heats and are eligible to send the winners to Wacken. An international jury votes on the performances, the best groups receive financial support from the Wacken Foundation as well as instruments and equipment provided by Metal Battle’s partners. Last but not least, the contest offers the possibility to get in touch with people from the music business worldwide. The contest has supported several bands throughout the years and has been a pivotal career launchpad for bands like Drone, Torture Squad, Battle Beast and Hammercult, to name a few. ***THE CHALLENGERS FOR THE VANCOUVER ISLAND ELIMINATION ROUND ARE*** : YEGG Old school death metal http://instagram.com/yeggmetal/ https://www.facebook.com/yeggmetal/ https://yeggmetal.bandcamp.com/track/offal-offering/ ELECTRIC DRUIDS Alternative metal https://www.instagram.com/electricdruidscanada/ https://www.facebook.com/ElectricDruids/ https://open.spotify.com/artist/0t7yMy9eJnsf4bFsbOUUnC GATE THEORY Experimental metal https://www.instagram.com/gate.theory/ https://www.facebook.com/profile.php?id=61552327835895 https://open.spotify.com/artist/2q89wjeTOFgpuufuumMUEx DECRYPTOR Death metal https://www.instagram.com/decryptorband/ https://www.facebook.com/DecryptorMetal/ https://open.spotify.com/artist/0o56HMJqzMeM1BgTcud6qU ANTLER Alternative metal https://www.instagram.com/antlerbandofficial/ https://www.facebook.com/AntlerBandCanada/ https://open.spotify.com/artist/5Ex0j3kBLXs4hMMcHnFZsH The winning band will continue to the BC semi-finals in Vancouver on May 3rd, from where one winner will represent BC at the National final, to be held in Vancouver on May 31 at The Rickshaw Theatre. ***Ages 19 and over.*** See less Music and audio Victoria, British Columbia Tickets Find Tickets Lucky Bar, Victoria 503 Yates St, Victoria, BC V8W, Canada Guests See All"
https://www.facebook.com/events/1300183384636801/,"Sunday 2 February 2025 from 11:00-15:00 Closing Event: Lucky Draw 221- 3147 Douglas Street, Victoria, BC, Canada, British Columbia V8Z 6E3 About Discussion More About Discussion Closing Event: Lucky Draw Details 39 people responded Event by Mayfair Shopping Centre 221- 3147 Douglas Street, Victoria, BC, Canada, British Columbia V8Z 6E3 Duration: 4 hr Public · Anyone on or off Facebook Join us for our Lunar New Year Closing Event: Lucky Draw, and start the year with abundance! On February 2nd, we’re wrapping up our Lunar New Year celebrations with a special FRE… See more Victoria, British Columbia 221- 3147 Douglas Street, Victoria, BC, Canada, British Columbia V8Z 6E3 3147 Douglas St, Victoria, BC V8Z 3K3, Canada Guests See All"
https://www.facebook.com/events/1377218180316681/,"Thursday at 19:00 The Smokestacks at Hermann's Jazz Club Roy and Lyndsy Tomorrow at 20:00 New West North American Tour '25 22 Feb at 17:00 – 23 Feb at 13:30 Weekend with Tango Janine Categories Classics Comedy Crafts Dance Drinks Fitness & workouts Foods Games Gardening Health & medical Healthy living and self-care Home and garden Music and audio Parties Professional networking Religions Shopping Social issues Sports Theatre TV and films Visual arts 28 28 Nov at 16:00 – 30 Nov at 17:00 Winter Bazaar at the Gorge Park Pavilion 1070 Tillicum Rd
Esquimalt Gorge Park Pavilion, Victoria, BC, Canada About Discussion More About Discussion Winter Bazaar at the Gorge Park Pavilion Interested Going Invite Details 156 people responded Event by Fernwood Makers PARTY and MORENA CLOTHING 1070 Tillicum Rd
Esquimalt Gorge Park Pavilion, Victoria, BC, Canada Duration: 3 days Public · Anyone on or off Facebook 120+ artists  from across BC and Alberta in the stunning Gorge Park Pavilion!! Stay tuned as we share all the exciting artists that will be joining us! This is not your average craft fair Victoria, British Columbia 1070 Tillicum Rd
Esquimalt Gorge Park Pavilion, Victoria, BC, Canada 1070 Tillicum Rd, Esquimalt, BC V9A 7M3, Canada Guests See All"
https://www.facebook.com/events/991883292782899/,"Sunday 26 January 2025 at 17:00 Straight Shooters Wolfpack Sportz Services About Discussion More About Discussion Straight Shooters Details 2 people responded Event by Cowichan Valley Mixed Billiard League Wolfpack Sportz Services Public · Anyone on or off Facebook Join in the fun at the Straight Shooters tournament. We have a few spots open, and registration is easy. Simply go to Wolfpack Sportz > Events>Upcoming Events> Straight Shooters Ja… See more Victoria, British Columbia Wolfpack Sportz Services Victoria Everything Pool! Pool Tournaments, Bots, Services and more. Guests See All"
https://www.facebook.com/events/563072016898316/,"Sunday 26 January 2025 from 16:00-20:00 Pneuma Breathwork: Amplify Consciousness & Calm the Mind #202-239 Menzies St., Victoria, BC, Canada, British Columbia V8V 2G6 About Discussion More About Discussion Pneuma Breathwork: Amplify Consciousness & Calm the Mind Details 2 people responded Event by Copper Mountain Centre #202-239 Menzies St., Victoria, BC, Canada, British Columbia V8V 2G6 Duration: 4 hr Public · Anyone on or off Facebook SUNDAY, JAN 26, 4-8 PM $60 per person Spaces Limited Go Beyond the Mind In this 4-hour workshop participants can experience - physical healing -energetic shifts - resolution to mental and emotional traumas - profound inner states of peace and beauty Book at link below: https://www.tickettailor.com/.../pneumainstitutec.../1360249 ? #breath #breathwork #breathworkhealing #pneuma #interdisciplinary #healthcollective #health #meditation #yyj #consciousnessshift #higherconsciousness #groupmeditation #groupbreathwork #breathe #breathedeep #breatheinbreatheout #breathein #calm See less Victoria, British Columbia #202-239 Menzies St., Victoria, BC, Canada, British Columbia V8V 2G6 239 Menzies St, Victoria, BC V8V 2G6, Canada Guests See All"
https://www.facebook.com/events/469944309546565/,"Saturday 8 February 2025 from 13:00-16:00 History & Heritage Day Royal BC Museum About Discussion More About Discussion History & Heritage Day Details 15 people responded Event by BC Black History Awareness Society Royal BC Museum Duration: 3 hr Public · Anyone on or off Facebook History & Heritage Day is an opportunity to meet and talk with direct descendants about their stories and family history. The exhibits include images, artifacts and archival documents. 2:00PM: Presentation BCBHAS Members Ron Nicholson and Door Gibson on the No. 2 Construction Battalion Apology and 2024-25 Legacy Project. Info on exhibiters: bcblackhistory.ca/events/black-history-and-heritage-day Thank you for the support from the Government of Canada and Province of BC. See less Victoria, British Columbia Royal BC Museum Sisters of St. Ann Archives, 675 Belleville St, Victoria, BC V8W 1A1, Canada Guests See All"
https://www.facebook.com/events/641004204946514/,"Saturday 8 February 2025 at 17:00 Open House Event - Dry Eye and Skin Treatments Emerald Eye Care Optometry About Discussion More About Discussion Open House Event - Dry Eye and Skin Treatments Details 3 people responded Event by Emerald Skin Care Emerald Eye Care Optometry Public · Anyone on or off Facebook Join us for an event focused on Dry Eye and Skin Treatments. Discover personalized solutions and meet the experts who can help you feel your best. See you there! Langford, British Columbia Emerald Eye Care Optometry 103 - 318 Wale road, Victoria Delivering quality service to our patients with our knowledgeable team of eye care professionals. Guests See All"
https://www.facebook.com/events/635302575702827/,"Wednesday 26 March 2025 at 18:00 Diversity in Motion: Confidence, Courage, and Community Royal BC Museum About Discussion More About Discussion Diversity in Motion: Confidence, Courage, and Community Interested Going Invite Details 16 people responded Event by Wear2Start Royal BC Museum Tickets www.canadahelps.org/en/charities/wear-2-start-society/events/diversity-in-motion-confidence-courage-and-community Public · Anyone on or off Facebook Date: Wednesday, March 26, 2025 Time: 6:00 PM to 9:00 PM Location: Royal BC Museum, 675 Belleville Street, Victoria,BC V8W 9W2 Hosted by: Wear2Start Society Event Highlights: -Interactive breakout sessions -Empowering storytelling sessions This free event has limited space, so we encourage you to register early. For more information and to secure your spot, please visit: https://www.canadahelps.org/.../diversity-in-motion.../ Refreshments will be provided. Please consider supporting Wear2Start with a donation. Disclaimer: Please note that some themes discussed during the event, may involve sensitive topics, including but not limited to personal adversity and trauma. We aim to create a supportive and respectful environment, but we encourage attendees to participate at their own comfort level. Please be assured that mental health resources will be available if anyone needs support during or after the event, ensuring you feel supported and cared for. See less Victoria, British Columbia Tickets Find Tickets Royal BC Museum Sisters of St. Ann Archives, 675 Belleville St, Victoria, BC V8W 1A1, Canada Guests See All"
https://www.facebook.com/events/1143120287482345/,"Friday 17 January 2025 at 19:00 Hermann's Event Hermann's Upstairs About Discussion More About Discussion Hermann's Event Details 4 people responded Event by The Sutcliffes Hermann's Upstairs Public · Anyone on or off Facebook This Friday at Hermann’s! Join us on a musical journey through Beatles history with The Sutcliffes—Vancouver Island’s premier Beatles tribute band. It’s gonna be legendary! Victoria, British Columbia Hermann's Upstairs 753 View Street, Victoria Hermann's Upstairs is the new place to be for live music and performance in downtown Victoria. Enjoy Guests See All"
https://www.facebook.com/events/1369047740890345/,"Saturday 11 January 2025 from 11:00-14:00 Sidewalk Talk - A Community Listening Event 735 Broughton St, Victoria, BC V8W 1E2, Canada About Discussion More About Discussion Sidewalk Talk - A Community Listening Event Details 28 people responded Event by Victoria Downtown Residents Association 735 Broughton St, Victoria, BC V8W 1E2, Canada Duration: 3 hr Public · Anyone on or off Facebook Come be listened to! What’s on your heart? In your thoughts? Taking up bandwidth? What can’t you say to those around you that you really need to share? Sidewalk Talk is a communit… See more Victoria, British Columbia 735 Broughton St, Victoria, BC V8W 1E2, Canada 735 Broughton St, Victoria, BC V8W 1E2, Canada Guests See All"
https://www.facebook.com/events/1422474392471567/,"Saturday 12 April 2025 from 14:45-16:45 Shamanic Drum Journey with Eve Carty 560 Johnson St #62 Market Square , Victoria, BC, Canada, British Columbia V8W 3C6 About Discussion More About Discussion Shamanic Drum Journey with Eve Carty Interested Going Invite Details 9 people responded Event by Earth and Sky Connection - British Columbia and Eve Carty 560 Johnson St #62 Market Square , Victoria, BC, Canada, British Columbia V8W 3C6 Duration: 2 hr Public · Anyone on or off Facebook Come experience the magic of a shamanic drum Journey with Eve Carty. A beautiful way to connect to your inner guidance, shamanic drum journeys are aunique way to deepen into your spiritual practice. Victoria, British Columbia 560 Johnson St #62 Market Square , Victoria, BC, Canada, British Columbia V8W 3C6 540 Johnson St, Victoria, BC V8W 1M3, Canada Guests See All"
https://www.facebook.com/events/2102278636900187/,"Thursday from 18:00-21:00 Nūma Breathwork Journey Church of Truth About Discussion More About Discussion Nūma Breathwork Journey Interested Going Invite Details 127 people responded Event by Nūma Breathwork Church of Truth Tickets www.trevordanielyelich.com/offers/zGNPE3rH/checkout Public · Anyone on or off Facebook Nūma Breathwork Journey Are you interested in clearing some space within your body, mind and heart? Or accessing insight or visionary experiences? Nūma Breathwork is a transfor… See more Victoria, British Columbia Tickets Find Tickets Church of Truth 111 Superior St, Victoria, BC V8V 1T2, Canada Guests See All"
https://www.facebook.com/events/1023812636206030/,"Thursday at 19:00 The Smokestacks at Hermann's Jazz Club Roy and Lyndsy Tomorrow at 20:00 New West North American Tour '25 Categories Classics Comedy Crafts Dance Drinks Fitness & workouts Foods Games Gardening Health & medical Healthy living and self-care Home and garden Music and audio Parties Professional networking Religions Shopping Social issues Sports Theatre TV and films Visual arts 19 Tomorrow from 18:30-20:30 Queer Open Stage Downtown | Next event – Wed, Feb 19th the Dock 18 Dec 2024 Wed, 15 Jan Wed, 19 Feb Wed, 19 Mar +5 About Discussion More About Discussion Queer Open Stage Downtown | Next event – Wed, Feb 19th Interested Going Invite Details 13 people responded Event by Sara Rose Hebert and Queer Open Stage Community - lək̓ʷəŋən Territory (Vic) the Dock Duration: 2 hr Public · Anyone on or off Facebook Are you an 2SLGBTQIA+ performer? Do you need a safe space to showcase your talent, find community, and network with other queer artists? Bring your performance to our...… See more Victoria, British Columbia the Dock 722 Cormorant St, Victoria, BC V8W 1P8, Canada Guests See All"
