url,extracted_text
https://www.facebook.com/events/509650461920120/,"Thursday at 19:00 The Smokestacks at Hermann's Jazz Club Roy and Lyndsy Tomorrow at 20:00 New West North American Tour '25 Categories Classics Comedy Crafts Dance Drinks Fitness & workouts Foods Games Gardening Health & medical Healthy living and self-care Home and garden Music and audio Parties Professional networking Religions Shopping Social issues Sports Theatre TV and films Visual arts 10 10 Aug at 06:00 – 14 Aug at 09:00 Blood Sweat & Gears Vancouver Island, BC, Canada About Discussion More About Discussion Blood Sweat & Gears Interested Going Invite Details 2 people responded Event by Al Fortune Vancouver Island, BC, Canada Duration: 5 days Public · Anyone on or off Facebook I will participating in two events and all proceeds helps send kids age 7 to 15 living with Type One Diabetes to a weeklong education camp. The first event in April, Pump Couture.… See more Victoria, British Columbia Vancouver Island, BC, Canada Guests See All"
https://www.facebook.com/events/599018726402485/,"Saturday 25 January 2025 from 11:00-17:00 A3U x Cherry Bomb Toys: A Pop-Up Shop Event Cherry Bomb Toys About Discussion More About Discussion A3U x Cherry Bomb Toys: A Pop-Up Shop Event Details 11 people responded Event by Ages Three and Up Cherry Bomb Toys Duration: 6 hr Public · Anyone on or off Facebook Pop-Up Shop Alert! Cherry Bomb Toys in Victoria, British Columbia is teaming up with Ages Three And Up for a super fun pop-up event! This will be the 2nd Pop-Up event for these two local BC toy shops, and if you attended last time, you know it’ll be lots of fun! When: Saturday, January 25 & Sunday, January 26, 2025 Time: 11:00 AM - 5:00 PM (both days) Where: Cherry Bomb Toys 719 Yates St, Victoria, BC V8W 1L6 Come check out a curated selection of toys from the shop including Transformers, action figures, model kits and more — perfect for all ages!  Plus, enjoy 20% OFF store-wide at Cherry Bomb Toys! Don't miss out on this awesome event to find the perfect gift or treat yourself to something special. Mark your calendars, invite your friends, and let's make this a weekend to remember! #VictoriaBC #PopUpShop #AgesThreeAndUp #CherryBombToys #ToyShopping #VictoriaEvents #ToyLovers #SupportLocal #CBTxA3U #vancouverBC #BurnabyBC #toyphotography Photo Credit: https://unsplash.com/@soltanloo See less Victoria, British Columbia Cherry Bomb Toys 719 Yates Street, Victoria *toys with memories included Guests See All"
https://www.facebook.com/events/4006200056303067/,"Saturday 25 January 2025 from 13:00-15:00 Lego Petshop Make and Take Event 3147 Douglas St, Victoria, BC, Canada V8Z 6E3 About Discussion More About Discussion Lego Petshop Make and Take Event Details 7 people responded Event by Indigo Mayfair 3147 Douglas St, Victoria, BC, Canada V8Z 6E3 Duration: 2 hr Public · Anyone on or off Facebook Join us on Saturday January 25th at 1pm for an in store Lego make and take event.  Have fun building a Lego Pet Shop creation and bringing it home to add to your collection.  Supplies are limited, be sure to arrive early if you want to participate in the fun. See less Victoria, British Columbia 3147 Douglas St, Victoria, BC, Canada V8Z 6E3 3147 Douglas St, Victoria, BC V8Z 3K3, Canada Guests See All"
https://www.facebook.com/events/1107413817603035/,"Saturday 7 June 2025 from 09:30-17:00 Island Vintage Events Spring Vintage Fair Victoria Italian Assistance Centre / da Vinci Centre About Discussion More About Discussion Island Vintage Events Spring Vintage Fair Interested Going Invite Details 53 people responded Event by Island Vintage Events Victoria Italian Assistance Centre / da Vinci Centre Duration: 7 hr 30 min Public · Anyone on or off Facebook Island Vintage Events Spring Vintage Fair Saturday June 7th 2025 9:30-5pm Da Vinci Centre 195 Bay Street M… See more Shopping Victoria, British Columbia Victoria Italian Assistance Centre / da Vinci Centre 195 Bay Street, Victoria VIAC/da Vinci Centre is the heart of the Italian community in the CRD. #WhereItalyMeetsVictoria Guests See All"
https://www.facebook.com/events/1729467794453961/,"Thursday at 19:00 The Smokestacks at Hermann's Jazz Club Roy and Lyndsy Tomorrow at 20:00 New West North American Tour '25 Categories Classics Comedy Crafts Dance Drinks Fitness & workouts Foods Games Gardening Health & medical Healthy living and self-care Home and garden Music and audio Parties Professional networking Religions Shopping Social issues Sports Theatre TV and films Visual arts 25 25 Oct at 10:00 – 26 Oct at 16:00 Halloween Market YYJ 2025 Victoria Italian Assistance Centre / da Vinci Centre About Discussion More About Discussion Halloween Market YYJ 2025 Interested Going Invite Details 461 people responded Event by Halloween Market YYJ and Lady Stardust Victoria Italian Assistance Centre / da Vinci Centre Duration: 2 days Public · Anyone on or off Facebook We are back for our 4th year, bringing you the best of Victoria’s spooky handmade vendors. Stay tuned for vendor intakes  at www.halloweenmarketyyj.com Victoria, British Columbia Victoria Italian Assistance Centre / da Vinci Centre 195 Bay St, Victoria, BC V9A 3K4, Canada Guests See All"
