source,keywords,link
Country Dance Lessons Victoria | Arthur Murray Dance Studio Victoria,2-step,https://victoriaarthurmurray.com/country-dance-lessons-victoria
Bachata Victoria BC (@bachatavictoria) • Instagram photos and videos,bachata,https://www.instagram.com/bachatavictoria/
Salsa Moderna - Victoria,bachata,https://latinvictoria.ca/
Ronald Martinez (@latindancecanada) • Instagram photos and videos,bachata,https://www.instagram.com/latindancecanada/
Profile for Bachata Kiz Salsa Victoria BC Dance,bachata,https://www.facebook.com/BaKiSaDance/
6th Victoria International Kizomba Fest: Sensual Edition: Bachata ...,bachata,https://www.eventbrite.com/e/6th-victoria-international-kizomba-fest-sensual-edition-bachata-kizomba-tickets-887280528947
Latin Dance Canada: Homepage,bachata,https://latindancecanada.com/
Alysha Kopala - Event Organizer - Bachata Nights Victoria | LinkedIn,bachata,https://ca.linkedin.com/in/alysha-kopala-35a44a15b
Victoria International Kizomba Festival 6th: SENSUAL EDITION,bachata,https://m.facebook.com/events/7500976340009306/
"Places to Dance Argentine Tango in Victoria, BC, Canada ...",bachata,https://www.danceplace.com/places/in/Argentine+Tango/Canada/Victoria_+BC
Victoria Balboa,balboa,https://www.facebook.com/groups/105613516148561/
Hello Victoria! We recently moved to the area and are looking for ...,cha cha,https://www.facebook.com/groups/2221001156/posts/10159101752271157/
Hello Victoria! We recently moved to the area and are looking for ...,cha cha cha,https://www.facebook.com/groups/2221001156/posts/10159101752271157/
Country Dance Lessons Victoria | Arthur Murray Dance Studio Victoria,country waltz,https://victoriaarthurmurray.com/country-dance-lessons-victoria
The Victoria English Ball,country waltz,https://vecds.bc.ca/wp-content/uploads/2023/04/Balls-through-the-years-2011-2019.pdf
Jam Tunes | Victoria Fiddle Society,country waltz,https://www.victoriafiddlesociety.com/jam-tunes/
Gord Light - Live Victoria,country waltz,https://livevictoria.com/gordlight
ARTISTS ANNOUNCEMENT ✅️ After teaching many workshops ...,douceur,https://www.instagram.com/vic_international_kizomba_fest/p/DFMAZDAy9Ko/
Victoria International Kizomba Festival 6th: SENSUAL EDITION,douceur,https://m.facebook.com/events/7500976340009306/
BACHATA ️ARTISTS line-up ✅️ We're super excited to have a ...,douceur,https://www.instagram.com/vic_international_kizomba_fest/p/DFY41LiS4Qj/?api=casas%2Bde%2Bapostas%2Bcom%2Bb%C3%B4nus%2Bgr%C3%A1tis%E3%80%90GB777.BET%E3%80%91.fbmh&hl=zh-cn
6th Victoria International Kizomba Fest: Sensual Edition: Bachata ...,douceur,https://www.eventbrite.com/e/6th-victoria-international-kizomba-fest-sensual-edition-bachata-kizomba-tickets-887280528947
Hola Comunidad ya llegó la fiesta Colombiana para las vísperas de ...,douceur,https://www.facebook.com/groups/1744359399094119/posts/2589861774543873/
Red Hot Swing - Victoria,east coast swing,https://www.redhotswing.com/
Dance Studios in British Columbia,east coast swing,https://thedancestudiofinder.com/dance-studios/locations/british-columbia/
"Strictly Lindy Hop Swing Vancouver, BC",east coast swing,https://www.facebook.com/groups/strictlylindy/
"WCS Lessons, Social Dances, and Conventions – BC Swing Dance ...",east coast swing,https://bcswingdance.ca/index.php/learn-to-dance/
Have a safe journey Anna Banana thats a heavy loss and i cant find ...,foxtrot,https://www.facebook.com/vinylondemandrecords/posts/have-a-safe-journey-anna-bananathats-a-heavy-loss-and-i-cant-find-the-proper-wor/1096573602472670/
6th Victoria International Kizomba Fest: Sensual Edition: Bachata ...,kizomba,https://www.eventbrite.com/e/6th-victoria-international-kizomba-fest-sensual-edition-bachata-kizomba-tickets-887280528947
Victoria Kizomba Lovers Group,kizomba,https://www.facebook.com/groups/1634269246863069/
"Victoria International Kizomba Festival 5th Edition Tickets, Thu, 28 ...",kizomba,https://www.eventbrite.com/e/victoria-international-kizomba-festival-5th-edition-tickets-650545909327
Victoria International KizombaFestival ...,kizomba,https://www.instagram.com/vic_international_kizomba_fest/
Kizomba Victoria BC,kizomba,https://www.facebook.com/KizombaVictoriaBC/
Victoria International Kizomba Festival 6th: SENSUAL EDITION,kizomba,https://m.facebook.com/events/7500976340009306/
GREAT DANCERS COMING TO THE VICTORIA INTERNATIONAL ...,kizomba,https://kizombaembassy.com/event/victoria-international-kizomba-festival/
"Victoria International Kizomba Festival 2025, Victoria, BC Canada ...",kizomba,https://www.danceplace.com/index/no/14580/Victoria+International+Kizomba+Festival-2025-Victoria_+BC-Canada-Kizomba+Dance+event
VICTORIA INTERNATIONAL KIZOMBA FESTIVAL | Visitor In Victoria,kizomba,https://visitorinvictoria.ca/victoria-international-kizomba-festival/
Featured Featured Events from February 27 – March 21 – Afro-Latin ...,kizomba,https://alces.world/events/list/featured/?shortcode=758c7f2c
"Profile for Red Hot Swing - Lindy Hop in Victoria, BC",lindy,https://www.facebook.com/RedHotSwing/
Victoria Lindy Exchange - Swing Victoria,lindy,https://www.swingvictoria.net/events/victoria-lindy-exchange
"Profile for Red Hot Swing - Lindy Hop in Victoria, BC",lindy hop,https://www.facebook.com/RedHotSwing/
Red Hot Swing - Victoria,lindy hop,https://www.redhotswing.com/
Victoria Lindy Hop & Beyond,lindy hop,https://www.facebook.com/groups/169950979714465/
Swing Dance Association of Victoria,lindy hop,https://www.swingvictoria.net/
Weekly Friday Social Dances – Red Hot Swing,lindy hop,https://www.redhotswing.com/?page_id=22
Victoria Lindy Exchange - Swing Victoria,lindy hop,https://www.swingvictoria.net/events/victoria-lindy-exchange
"Victoria Lindy Exchange 2025, Victoria, BC Canada May 17 2025 ...",lindy hop,https://www.danceplace.com/index/no/14800/Victoria+Lindy+Exchange-2025-Victoria_+BC-Canada-Lindy+Hop+Dance+event
Where to Swing Dance in Victoria - Swing Victoria,lindy hop,https://www.swingvictoria.net/faq/where-to-swing-dance-in-victoria
"Rainy day walk by Elk Lake and since there were few on the trail, I ...",lindy hop,https://www.instagram.com/angelaverbrugge/p/DGaDuu4Nk6m/
Dance Class Suggestions etc : r/VictoriaBC,lindy hop,https://www.reddit.com/r/VictoriaBC/comments/16xpl6q/dance_class_suggestions_etc/
"Line Dancing in Victoria, British Columbia, Canada: Joe & Cindy ...",line dance,https://linedancingvictoria.wordpress.com/
Country Dance Lessons Victoria | Arthur Murray Dance Studio Victoria,line dance,https://victoriaarthurmurray.com/country-dance-lessons-victoria
About Nuline Line Dancing – Joe & Cindy Archer,line dance,https://linedancingvictoria.wordpress.com/line-dancing/
"TOP 10 BEST Line Dancing in Victoria, BC - Updated 2025 - Yelp",line dance,https://www.yelp.ca/search?find_desc=Line+Dancing&find_loc=Victoria%2C+BC
Nanaimo Dance Fusion,line dance,https://www.nanaimodancefusion.ca/
Bi-Weekly Free Line Dancing Lessons,line dance,https://www.facebook.com/events/the-duke-saloon/bi-weekly-free-line-dancing-lessons/284117448595473/
Canada | Nuline Dance | Line Dancing and Other Dances,line dance,https://www.nulinedance.com/my-classes/canada/
"Line Dancing at the Red Barn Tickets, Sat, Nov 9, 2024 at 6:00 PM ...",line dance,https://www.eventbrite.com/e/line-dancing-at-the-red-barn-tickets-1000937479947
Anyone in Victoria BC know where young party people hang out ...,line dance,https://www.reddit.com/r/VictoriaBC/comments/1anqssx/anyone_in_victoria_bc_know_where_young_party/
Alive Tango Victoria – Argentine Tango in Victoria BC,milonga,https://alivetangovictoria.ca/
Alive Tango Victoria,milonga,https://www.facebook.com/groups/alivetango/
"John SANDERS Obituary (June 18, 1938 - Victoria, BC",milonga,https://www.legacy.com/ca/obituaries/timescolonist/name/john-sanders-obituary?id=40095957
Profile for Victoria Tango Marathon,milonga,https://www.facebook.com/victoriatangomarathon/
Victoria Tango Marathon – April 11-13 2025,milonga,https://victoriatangomarathon.com/
Paparazzi Night Club (2025) - All You Need to Know BEFORE You ...,night club,https://www.tripadvisor.com/Attraction_Review-g154945-d4555566-Reviews-Paparazzi_Night_Club-Victoria_Victoria_Capital_Regional_District_Vancouver_Island.html
Ok people ... what about NY NY nightclub on Yates? Anyone have ...,night club,https://www.facebook.com/groups/312703430332/posts/10161993916275333/
"The Capital Ballroom • Capital Ballroom, previously known as Sugar ...",night club,https://thecapitalballroom.com/
Paparazzi Night Club (2025) - All You Need to Know BEFORE You ...,nite club,https://www.tripadvisor.com/Attraction_Review-g154945-d4555566-Reviews-Paparazzi_Night_Club-Victoria_Victoria_Capital_Regional_District_Vancouver_Island.html
Ok people ... what about NY NY nightclub on Yates? Anyone have ...,nite club,https://www.facebook.com/groups/312703430332/posts/10161993916275333/
What's the deal with Paparazzi Nightclub these days? Is it no longer ...,nite club 2,https://www.reddit.com/r/VictoriaBC/comments/11t6lks/whats_the_deal_with_paparazzi_nightclub_these/
Paparazzi Night Club (2025) - All You Need to Know BEFORE You ...,nite club 2,https://www.tripadvisor.com/Attraction_Review-g154945-d4555566-Reviews-Paparazzi_Night_Club-Victoria_Victoria_Capital_Regional_District_Vancouver_Island.html
"Paparazzi Nightclub (@paparazzinightclubvictoria) · Victoria, BC",nite club 2,https://www.instagram.com/paparazzinightclubvictoria/?hl=en
What's the deal with Paparazzi Nightclub these days? Is it no longer ...,nite club two,https://www.reddit.com/r/VictoriaBC/comments/11t6lks/whats_the_deal_with_paparazzi_nightclub_these/
Paparazzi Night Club (2025) - All You Need to Know BEFORE You ...,nite club two,https://www.tripadvisor.com/Attraction_Review-g154945-d4555566-Reviews-Paparazzi_Night_Club-Victoria_Victoria_Capital_Regional_District_Vancouver_Island.html
"Paparazzi Nightclub (@paparazzinightclubvictoria) · Victoria, BC",nite club two,https://www.instagram.com/paparazzinightclubvictoria/?hl=en
Quickstep Dance Studios,quickstep,https://thedancestudiofinder.com/dance-studios/categories/quickstep/
"The Coda (Downtown Victoria) Fri Speakeasy Vibes, Vocal Jazz and ...",quickstep,https://creativelyunited.org/event/the-coda-downtown-victoria-fri-speakeasy-vibes-vocal-jazz-and-swing-dance-celebrate-mardi-gras/
Dance Praktika,quickstep,https://m.facebook.com/61564813876208/
Jesse Cook in Concert – leaving the best to last. | My Global Event ...,rhumba,https://myglobaleventreports.wordpress.com/2015/06/07/jesse-cook-in-concert-leaving-the-best-to-last/
Profile for Victoria Viva la Fiesta,rhumba,https://www.facebook.com/people/Victoria-Viva-la-Fiesta/61553917640310/
"Colombian Rumba Nights Party Saturday, April 6th Doors & Show ...",rhumba,https://www.instagram.com/victoriavivalafiesta/p/C43-tWcPVGA/
"Rainy day walk by Elk Lake and since there were few on the trail, I ...",rhumba,https://www.instagram.com/angelaverbrugge/p/DGaDuu4Nk6m/
Colombian Rumba Barranquilla Carnival Party in Victoria at,rhumba,https://do250.com/events/2025/3/14/colombian-rumba-barranquilla-carnival-party-tickets
"Colombian Rumba Nights Party Saturday, April 6th Doors & Show ...",rumba,https://www.instagram.com/victoriavivalafiesta/p/C43-tWcPVGA/
Profile for Victoria Viva la Fiesta,rumba,https://www.facebook.com/people/Victoria-Viva-la-Fiesta/61553917640310/
Profile for The Coda,rumba,https://www.facebook.com/gotothecoda/
Colombian Rumba Barranquilla Carnival Party in Victoria at,rumba,https://do250.com/events/2025/3/14/colombian-rumba-barranquilla-carnival-party-tickets
Colombian Rumba Barranquilla Carnival Night in Victoria at The,rumba,https://do250.com/events/2025/3/14/colombian-rumba-barranquilla-carnival-night-tickets
Profile for Salsa dances etc. - Victoria BC,salsa,https://www.facebook.com/salsadancevictoriabc/
Bachata Victoria BC (@bachatavictoria) • Instagram photos and videos,salsa,https://www.instagram.com/bachatavictoria/
Hello Victoria! We recently moved to the area and are looking for ...,salsa,https://www.facebook.com/groups/2221001156/posts/10159101752271157/
Ronald Martinez (@latindancecanada) • Instagram photos and videos,salsa,https://www.instagram.com/latindancecanada/
Latin Dance Canada: Homepage,salsa,https://latindancecanada.com/
Salsa Caliente,salsa,https://calientedance.com/about-us/
Salsa Moderna - Victoria,salsa,https://latinvictoria.ca/
"Mardi Gras Samba workshop, Victoria, BC, Canada, British ...",samba,https://allevents.in/victoria/mardi-gras-samba-workshop/200027790433016
Dance Praktika,samba,https://m.facebook.com/61564813876208/
ARTISTS ANNOUNCEMENT ✅️ After teaching many workshops ...,semba,https://www.instagram.com/vic_international_kizomba_fest/p/DFMAZDAy9Ko/
Victoria Kizomba Lovers Group,semba,https://www.facebook.com/groups/1634269246863069/
Go where you are celebrated. Where you feel like celebrating. Find ...,semba,https://www.instagram.com/ashbylaine/p/C7R4JGPucXz/go-where-you-are-celebratedwhere-you-feel-like-celebrating-find-more-and-more-to/
Victoria International Kizomba Festival 6th: SENSUAL EDITION,semba,https://m.facebook.com/events/7500976340009306/
Unity: Kizomba/Semba/Afro Weekend,semba,https://www.facebook.com/events/kw-studios/-unity-kizombasembaafro-weekend-/1094815942205490/
All your dance events in one freaking place! | WhereCanWeDance ...,semba,https://www.wherecanwedance.com/event_types/festival
All your dance events in one freaking place! | WhereCanWeDance ...,semba,https://wherecanwedance.com/event_frequencies/annual
6th Victoria International Kizomba Fest: Sensual Edition: Bachata ...,semba,https://www.eventbrite.com/e/6th-victoria-international-kizomba-fest-sensual-edition-bachata-kizomba-tickets-887280528947
Red Hot Swing - Victoria,swing,https://www.redhotswing.com/
Swing Victoria,swing,https://www.swingvictoria.net/
Alive Tango Victoria – Argentine Tango in Victoria BC,tango,https://alivetangovictoria.ca/
Alive Tango Victoria,tango,https://www.facebook.com/groups/alivetango/
Victoria Tango Marathon – April 11-13 2025,tango,https://victoriatangomarathon.com/
Alive Tango Victoria (@alivetangovictoria) • Instagram photos and ...,tango,https://www.instagram.com/alivetangovictoria/
"Places to Dance Argentine Tango in Victoria, BC, Canada ...",tango,https://www.danceplace.com/places/in/Argentine+Tango/Canada/Victoria_+BC
Victoria Malou | TikTok,tarraxa,https://www.tiktok.com/discover/victoria-malou
Kizomba Victoria,tarraxa,https://www.facebook.com/groups/265269613666246/
Salsa Dancing Events in Europe,tarraxa,https://latindancecalendar.com/events/location/europe/
Salsa Dancing Events in Spain - Latin Dance Calendar,tarraxa,https://latindancecalendar.com/events/location/spain/
AUDI & LAURA SPECIAL TRAINING PROGRAM LEVEL UP ...,tarraxinha,https://www.instagram.com/vic_international_kizomba_fest/p/C3Vy_4nvgmP/
Victoria International Kizomba Festival 6th: SENSUAL EDITION,tarraxinha,https://m.facebook.com/events/7500976340009306/
ARTISTS ANNOUNCEMENT ✅️ After teaching many workshops ...,tarraxinha,https://www.instagram.com/vic_international_kizomba_fest/p/DFMAZDAy9Ko/
6th Victoria International Kizomba Fest: Sensual Edition: Bachata ...,tarraxinha,https://www.eventbrite.com/e/6th-victoria-international-kizomba-fest-sensual-edition-bachata-kizomba-tickets-887280528947
Hola Comunidad ya llegó la fiesta Colombiana para las vísperas de ...,tarraxinha,https://www.facebook.com/groups/1744359399094119/posts/2589861774543873/
"Victoria International Kizomba Festival 2025, Victoria, BC Canada ...",tarraxinha,https://www.danceplace.com/index/no/14580/Victoria+International+Kizomba+Festival-2025-Victoria_+BC-Canada-Kizomba+Dance+event
We are looking forward to dancing with everyone! Fun new combo ...,tarraxinha,https://www.facebook.com/groups/vanislanddance/posts/1044246914382748/
Victoria International Kizomba Festival 6th Edition - Afro-Latin ...,tarraxinha,https://alces.world/event/victoria-international-kizomba-festival-6th-edition/
Victoria Viva la Fiesta,tarraxinha,https://www.facebook.com/groups/1744359399094119/
"Urbankiz & Tarraxo Workshops with Mike Ahombi, Ukrainian ...",tarraxo,https://allevents.in/victoria/urbankiz-and-tarraxo-workshops-with-mike-ahombi/200027854470525
AUDI & LAURA SPECIAL TRAINING PROGRAM LEVEL UP ...,tarraxo,https://www.instagram.com/vic_international_kizomba_fest/p/C3Vy_4nvgmP/
Past Events from February 13 – March 6 – Afro-Latin Cultural ...,tarraxo,https://alces.world/events/list/?shortcode=758c7f2c&eventDisplay=past
7 spots left!!! A weekend full of learning!!! <3 Tarraxo coming to ...,tarraxo,https://www.facebook.com/groups/vancitykizomba/posts/2048176842270205/
Victoria International Kizomba Festival 6th: SENSUAL EDITION,tarraxo,https://m.facebook.com/events/7500976340009306/
All your dance events in one freaking place! | WhereCanWeDance ...,tarraxo,https://wherecanwedance.com/event_frequencies/annual
All your dance events in one freaking place! | WhereCanWeDance ...,tarraxo,https://www.wherecanwedance.com/event_types/festival
"Victoria International Kizomba Festival 5th Edition Tickets, Thu, 28 ...",tarraxo,https://www.eventbrite.com/e/victoria-international-kizomba-festival-5th-edition-tickets-650545909327
GREAT DANCERS COMING TO THE VICTORIA INTERNATIONAL ...,tarraxo,https://kizombaembassy.com/event/victoria-international-kizomba-festival/
Country Dance Lessons Victoria | Arthur Murray Dance Studio Victoria,two step,https://victoriaarthurmurray.com/country-dance-lessons-victoria
Victoria Kizomba Lovers Group,urban kiz,https://www.facebook.com/groups/1634269246863069/
"Urban Kiz Workshop with Mannie, Ukrainian Cultural Centre ...",urban kiz,https://allevents.in/victoria/urban-kiz-workshop-with-mannie/200027895851630
Past Events from February 13 – March 6 – Afro-Latin Cultural ...,urban kiz,https://alces.world/events/list/?shortcode=758c7f2c&eventDisplay=past
"Urbankiz & Tarraxo Workshops with Mike Ahombi, Ukrainian ...",urban kiz,https://allevents.in/victoria/urbankiz-and-tarraxo-workshops-with-mike-ahombi/200027854470525
ARTISTS ANNOUNCEMENT ✅️ After teaching many workshops ...,urban kiz,https://www.instagram.com/vic_international_kizomba_fest/p/DFMAZDAy9Ko/
All your dance events in one freaking place! | WhereCanWeDance ...,urban kiz,https://wherecanwedance.com/event_frequencies/annual
Victoria International Kizomba Festival 6th: SENSUAL EDITION,urban kiz,https://m.facebook.com/events/7500976340009306/
All your dance events in one freaking place! | WhereCanWeDance ...,urban kiz,https://www.wherecanwedance.com/event_types/festival
GREAT DANCERS COMING TO THE VICTORIA INTERNATIONAL ...,urban kiz,https://kizombaembassy.com/event/victoria-international-kizomba-festival/
Beginners Waltz and Tango - Dance Victoria,waltz,https://dancevictoria.com/event/beginners-waltz-and-tango/
Arthur Murray Victoria: Ballroom Dance Lessons,waltz,https://victoriaarthurmurray.com/
"Tickets for Cirque du Soleil CRYSTAL in Victoria, BC at Save-on ...",waltz,https://www.cirquedusoleil.com/canada/victoria/crystal/buy-tickets
World-renowned bassist Gary Karr's last waltz - Victoria Times Colonist,waltz,https://www.timescolonist.com/entertainment/world-renowned-bassist-gary-karrs-last-waltz-4642222
Victoria West Coast Swing Collective,wcs,https://www.facebook.com/groups/victoriawestcoastswingcollective/
Victoria West Coast Swing Collective Society,wcs,https://www.victoriawestcoastswing.com/
Victoria West Coast Swing Collective,west coast swing,https://www.facebook.com/groups/victoriawestcoastswingcollective/
Victoria West Coast Swing Collective Society,west coast swing,https://www.victoriawestcoastswing.com/
Victoria West Coast Swing Dancing,west coast swing,https://www.facebook.com/groups/victoriawesties/
West Coast Swing – Victoria Ballroom Dance Society,west coast swing,https://vbds.org/dances/west-coast-swing/
"WCS Lessons, Social Dances, and Conventions – BC Swing Dance ...",west coast swing,https://bcswingdance.ca/index.php/learn-to-dance/
Red Hot Swing - Victoria,west coast swing,https://www.redhotswing.com/
Nanaimo Dance Fusion,west coast swing,https://www.nanaimodancefusion.ca/
Sandro ZK,zouk,https://www.facebook.com/sandrosoncini/
Profile for Zouk Victoria,zouk,https://www.facebook.com/zoukvictoria/
"Victoria Lindy Exchange 2025, Victoria, BC Canada May 17 2025 ...",zouk,https://www.danceplace.com/index/no/14800/Victoria+Lindy+Exchange-2025-Victoria_+BC-Canada-Lindy+Hop+Dance+event
Open House | FREE Classes - Bachata Sensual & Brazilian Zouk ...,zouk,https://allevents.in/victoria/open-house-%7C-free-classes-bachata-sensual-and-brazilian-zouk/200027908549715
"Victoria International Kizomba Festival 2025, Victoria, BC Canada ...",zouk,https://www.danceplace.com/index/no/14580/Victoria+International+Kizomba+Festival-2025-Victoria_+BC-Canada-Kizomba+Dance+event
Rick Clark - Project Engineer and Process Improvement Manager ...,zouk,https://ca.linkedin.com/in/rickclark-eit
ARTISTS ANNOUNCEMENT ✅️ After teaching many workshops ...,zouk,https://www.instagram.com/vic_international_kizomba_fest/p/DFMAZDAy9Ko/
All your dance events in one freaking place! | WhereCanWeDance ...,zouk,https://wherecanwedance.com/event_frequencies/annual
