dance_style,keywords,processed
ballroom,"dance, foxtrot, quickstep, rumba, samba, waltz",True
country,"double shuffle, country waltz, line dance, nite club two, two step",True
kizomba,"kizomba, urban kiz, semba",False
latin,"bachata,  cha cha,  merengue, salsa,  zouk",False
swing,"balboa, east coast swing,  lindy hop, swing",False
tango,"milonga tango, argentine tango, tango",False
wcs,"west coast swing, wcs",False
tango,"milonga, tango",False
music,"live music, music festivals, outdoor music",False
